<?xml version="1.0" encoding="UTF-8"?>
<Post xmlns:xsi="http://www.w3.org/2001/XMLSchema-instance" xsi:noNamespaceSchemaLocation="post.xsd">
    <Id>1</Id>
        <AuthorName>John Doe</AuthorName>
        <ProfileImage>https://randomuser.me/api/portraits/men/1.jpg</ProfileImage>
        <DateTime>2024-11-04T10:30:00</DateTime>
        <PostTitle>Titolo 1</PostTitle>
        <MessageText>This is my first post on this platform!</MessageText>
        <MessageImage>https://picsum.photos/200/300</MessageImage>
        <Likes>20</Likes>
        <Comments>
            <Comment>
                <Id>1</Id>
                <CommentAuthorName>Jane Smith</CommentAuthorName>
                <CommentProfileImage>https://randomuser.me/api/portraits/women/1.jpg</CommentProfileImage>
                <CommentDateTime>2024-11-04T11:00:00</CommentDateTime>
                <CommentText>Great post, John!</CommentText>
                <CommentImage>https://picsum.photos/200/300?random=1</CommentImage>
                <CommentLikes>5</CommentLikes>
            </Comment>
            <Comment>
                <Id>2</Id>
                <CommentAuthorName>Mike Jones</CommentAuthorName>
                <CommentProfileImage>https://randomuser.me/api/portraits/men/2.jpg</CommentProfileImage>
                <CommentDateTime>2024-11-04T11:05:00</CommentDateTime>
                <CommentText>Welcome to the platform!</CommentText>
                <CommentLikes>3</CommentLikes>
            </Comment>
        </Comments>
</Post>